{"$schema":"https://json-schema.org/draft/2020-12/schema","title":"Language Project Unicode script record","type":"object","required":["name","ranges","codepoints"],"properties":{"name":{"type":"string"},"iso15924":{"type":["string","null"]},"ranges":{"type":"array"},"letters":{"type":"integer"},"marks":{"type":"integer"},"numbers":{"type":"integer"},"codepoints":{"type":"integer"},"sample":{"type":"array"}}}
