{
  "name": "Marchen",
  "iso15924": "Marc",
  "ranges": [
    [
      "U+11C70",
      "U+11C71"
    ],
    [
      "U+11C72",
      "U+11C8F"
    ],
    [
      "U+11C92",
      "U+11CA7"
    ],
    [
      "U+11CA9",
      "U+11CA9"
    ],
    [
      "U+11CAA",
      "U+11CB0"
    ],
    [
      "U+11CB1",
      "U+11CB1"
    ],
    [
      "U+11CB2",
      "U+11CB3"
    ],
    [
      "U+11CB4",
      "U+11CB4"
    ],
    [
      "U+11CB5",
      "U+11CB6"
    ]
  ],
  "letters": 30,
  "marks": 36,
  "numbers": 0,
  "sample": [
    "𑱲",
    "𑱳",
    "𑱴",
    "𑱵",
    "𑱶",
    "𑱷",
    "𑱸",
    "𑱹",
    "𑱺",
    "𑱻",
    "𑱼",
    "𑱽",
    "𑱾",
    "𑱿",
    "𑲀",
    "𑲁",
    "𑲂",
    "𑲃",
    "𑲄",
    "𑲅",
    "𑲆",
    "𑲇",
    "𑲈",
    "𑲉",
    "𑲊",
    "𑲋",
    "𑲌",
    "𑲍",
    "𑲎",
    "𑲏"
  ],
  "codepoints": 68
}