{
  "name": "Old_North_Arabian",
  "iso15924": "Narb",
  "ranges": [
    [
      "U+10A80",
      "U+10A9C"
    ],
    [
      "U+10A9D",
      "U+10A9F"
    ]
  ],
  "letters": 29,
  "marks": 0,
  "numbers": 3,
  "sample": [
    "𐪀",
    "𐪁",
    "𐪂",
    "𐪃",
    "𐪄",
    "𐪅",
    "𐪆",
    "𐪇",
    "𐪈",
    "𐪉",
    "𐪊",
    "𐪋",
    "𐪌",
    "𐪍",
    "𐪎",
    "𐪏",
    "𐪐",
    "𐪑",
    "𐪒",
    "𐪓",
    "𐪔",
    "𐪕",
    "𐪖",
    "𐪗",
    "𐪘",
    "𐪙",
    "𐪚",
    "𐪛",
    "𐪜"
  ],
  "codepoints": 32
}