{
  "name": "Saurashtra",
  "iso15924": "Saur",
  "ranges": [
    [
      "U+A880",
      "U+A881"
    ],
    [
      "U+A882",
      "U+A8B3"
    ],
    [
      "U+A8B4",
      "U+A8C3"
    ],
    [
      "U+A8C4",
      "U+A8C5"
    ],
    [
      "U+A8CE",
      "U+A8CF"
    ],
    [
      "U+A8D0",
      "U+A8D9"
    ]
  ],
  "letters": 50,
  "marks": 20,
  "numbers": 10,
  "sample": [
    "ꢂ",
    "ꢃ",
    "ꢄ",
    "ꢅ",
    "ꢆ",
    "ꢇ",
    "ꢈ",
    "ꢉ",
    "ꢊ",
    "ꢋ",
    "ꢌ",
    "ꢍ",
    "ꢎ",
    "ꢏ",
    "ꢐ",
    "ꢑ",
    "ꢒ",
    "ꢓ",
    "ꢔ",
    "ꢕ",
    "ꢖ",
    "ꢗ",
    "ꢘ",
    "ꢙ",
    "ꢚ",
    "ꢛ",
    "ꢜ",
    "ꢝ",
    "ꢞ",
    "ꢟ",
    "ꢠ",
    "ꢡ",
    "ꢢ",
    "ꢣ",
    "ꢤ",
    "ꢥ"
  ],
  "codepoints": 82
}