{
  "name": "Grantha",
  "iso15924": "Gran",
  "ranges": [
    [
      "U+11300",
      "U+11301"
    ],
    [
      "U+11302",
      "U+11303"
    ],
    [
      "U+11305",
      "U+1130C"
    ],
    [
      "U+1130F",
      "U+11310"
    ],
    [
      "U+11313",
      "U+11328"
    ],
    [
      "U+1132A",
      "U+11330"
    ],
    [
      "U+11332",
      "U+11333"
    ],
    [
      "U+11335",
      "U+11339"
    ],
    [
      "U+1133C",
      "U+1133C"
    ],
    [
      "U+1133D",
      "U+1133D"
    ],
    [
      "U+1133E",
      "U+1133F"
    ],
    [
      "U+11340",
      "U+11340"
    ],
    [
      "U+11341",
      "U+11344"
    ],
    [
      "U+11347",
      "U+11348"
    ],
    [
      "U+1134B",
      "U+1134D"
    ],
    [
      "U+11350",
      "U+11350"
    ],
    [
      "U+11357",
      "U+11357"
    ],
    [
      "U+1135D",
      "U+11361"
    ],
    [
      "U+11362",
      "U+11363"
    ],
    [
      "U+11366",
      "U+1136C"
    ],
    [
      "U+11370",
      "U+11374"
    ]
  ],
  "letters": 53,
  "marks": 32,
  "numbers": 0,
  "sample": [
    "𑌅",
    "𑌆",
    "𑌇",
    "𑌈",
    "𑌉",
    "𑌊",
    "𑌋",
    "𑌌",
    "𑌏",
    "𑌐",
    "𑌓",
    "𑌔",
    "𑌕",
    "𑌖",
    "𑌗",
    "𑌘",
    "𑌙",
    "𑌚",
    "𑌛",
    "𑌜",
    "𑌝",
    "𑌞",
    "𑌟",
    "𑌠",
    "𑌡",
    "𑌢",
    "𑌣",
    "𑌤",
    "𑌥",
    "𑌦",
    "𑌧",
    "𑌨",
    "𑌪",
    "𑌫",
    "𑌬",
    "𑌭"
  ],
  "codepoints": 85
}