{
  "name": "Duployan",
  "iso15924": "Dupl",
  "ranges": [
    [
      "U+1BC00",
      "U+1BC6A"
    ],
    [
      "U+1BC70",
      "U+1BC7C"
    ],
    [
      "U+1BC80",
      "U+1BC88"
    ],
    [
      "U+1BC90",
      "U+1BC99"
    ],
    [
      "U+1BC9C",
      "U+1BC9C"
    ],
    [
      "U+1BC9D",
      "U+1BC9E"
    ],
    [
      "U+1BC9F",
      "U+1BC9F"
    ]
  ],
  "letters": 139,
  "marks": 2,
  "numbers": 0,
  "sample": [
    "𛰀",
    "𛰁",
    "𛰂",
    "𛰃",
    "𛰄",
    "𛰅",
    "𛰆",
    "𛰇",
    "𛰈",
    "𛰉",
    "𛰊",
    "𛰋",
    "𛰌",
    "𛰍",
    "𛰎",
    "𛰏",
    "𛰐",
    "𛰑",
    "𛰒",
    "𛰓",
    "𛰔",
    "𛰕",
    "𛰖",
    "𛰗",
    "𛰘",
    "𛰙",
    "𛰚",
    "𛰛",
    "𛰜",
    "𛰝",
    "𛰞",
    "𛰟",
    "𛰠",
    "𛰡",
    "𛰢",
    "𛰣"
  ],
  "codepoints": 143
}